{
  "schema_version": 1,
  "id": "minimal",
  "locale": "en-US",
  "timezone": "UTC",
  "markets": {
    "hk": {
      "timezone": "UTC",
      "label": "Example HK market",
      "analysis_command": "analyze-hk",
      "skill": null
    }
  },
  "workflows": {
    "intraday": {
      "enabled": true,
      "markets": ["hk"],
      "policy": "intraday"
    }
  },
  "resources": {
    "portfolio": "portfolio.json",
    "instruments": "config/instruments.json",
    "schedule_contract": "config/schedule.json"
  },
  "delivery": {
    "provider": "filesystem",
    "targets": {
      "primary": {"source": "disabled"}
    }
  }
}
