{
  "schema_version": 1,
  "id": "kcnyu",
  "locale": "zh-CN",
  "timezone": "Asia/Hong_Kong",
  "markets": {
    "hk": {
      "timezone": "Asia/Hong_Kong",
      "label": "港股",
      "analysis_command": "analyze-hk",
      "skill": "hk-stock-analysis"
    },
    "us": {
      "timezone": "America/New_York",
      "label": "美股",
      "analysis_command": "analyze-us",
      "skill": "us-stock-analysis"
    }
  },
  "workflows": {
    "brief": {
      "enabled": true,
      "markets": ["hk", "us"],
      "policy": "brief"
    },
    "report": {
      "enabled": true,
      "markets": ["hk", "us"],
      "policy": "report"
    },
    "intraday": {
      "enabled": true,
      "markets": ["hk", "us"],
      "policy": "intraday"
    }
  },
  "resources": {
    "portfolio": "portfolio.json",
    "instruments": "config/instruments.json",
    "schedule_contract": "config/cron-schedules.json"
  },
  "delivery": {
    "provider": "openclaw",
    "targets": {
      "wechat": {"source": "runtime_job"},
      "telegram": {"source": "static", "value": "2033937852"}
    }
  }
}
